Input Prompt,Output Answer,Uncertainty,Model
tell me about the international and national arenas in Cyprus,"Cyprus is located in the Eastern Mediterranean, and is a significant player on both the international and national stages. On the international front, Cyprus is a member of several global organizations, including the United Nations, the European Union and the Commonwealth. Cyprus is also an active player in the Council of Europe, the World Bank, and the International Monetary Fund.

The country has been divided into a Greek-speaking south and a Turkish-speaking north since a 1974 military coup was followed by a Turkish invasion of the",4.8510298430919665,gpt-4
How did the european union react when cyprus was divided along ethnic lines in 1964 due to EOKA terror campaign?,"The European Union as an entity did not exist in its current form in 1964, so it did not have an immediate, direct reaction to the division of Cyprus following the EOKA campaign. However, individual European countries, as members of the United Nations, were part of the international efforts to resolve the dispute in Cyprus.

The division of Cyprus has remained a contentious issue in the region and has impacted Cyprus's relationship with the European Union after its formation. Cyprus joined the EU in 2004",3.8432433605194083,gpt-4
Have the greek Cypriots always constituted a majority in Cyprus?,"Yes, Greek Cypriots have historically been the majority population in Cyprus. Prior to the 1974 Turkish invasion, Greek Cypriots comprised around 80% of the island's population, while Turkish Cypriots made up around 18%. Currently, Greek Cypriots make up the majority in the Republic of Cyprus, while Turkish Cypriots are the majority in the self-declared Turkish Republic of Northern Cyprus.",5.0650832056999215,gpt-4
What about the bronze time in cyprus,"The Bronze Age in Cyprus, also known as the Cypriot Bronze Age, lasted from approximately 2300 BC to 1050 BC. This period in Cypriot history is significant because it was during this time that metalworking, particularly bronze work, greatly developed, influencing various aspects of the society.

Archaeological findings from this period include tools, weapons, and various forms of artwork made from bronze. This period is further divided into several phases including the Early Cypriot, Middle C",3.1495467588453416,gpt-4
What were the causes of the Turkish invasion in Cyprus?,"The Turkish invasion of Cyprus in 1974, also known as Operation Attila, was driven by several key factors:

1. Ethnic Tensions: The island of Cyprus has a mixed population of Greeks and Turks. The majority Greeks desired to unite the island with mainland Greece, a concept known as “Enosis.” However, the Turkish Cypriots opposed this and pushed for ""Taksim,"" or division of the island. Such ethnic tensions often led to violence.

2. Constitutional Crisis",2.666512623429299,gpt-4
What was the Greek Junta?,"The Greek Junta, also known as the ""Regime of the Colonels,"" refers to a period of right-wing authoritarian rule in Greece from 1967 to 1974. It began when a group of Greek military officers seized power in a coup d'état, citing a need to ""save the nation"" from a supposed communist threat. During the junta, political freedoms and civil rights were significantly restricted, and extensive censorship was in place. The regime ended in 1974 following a",2.4059594314911648,gpt-4
Did Greek-Cypriots involved in the Greek junta?,"Yes, Greek-Cypriots were involved in the Greek junta. The coup d'état that overthrew Archbishop Makarios III, the first President of Cyprus, in 1974 was orchestrated by the Greek military junta. The junta sought to unite Cyprus with Greece, a concept known as Enosis. However, this triggered a Turkish invasion of Cyprus, which remains divided to this day. Many Greek-Cypriots who supported the junta either actively participated in its activities or",5.042976796627046,gpt-4
what about the Classical Period of Cyprus?,"The Classical Period in Cyprus, also known as the Cypriot Classical Age, spanned from 480 to 310 BCE. 

During this period, Cyprus was heavily influenced by Greek culture, both due to the proximity of the two regions and due to the influx of Greek settlers. Settlers brought with them the Greek language, religion, art, and political systems, all of which had a profound impact on Cypriot culture.

There were frequent power struggles on the island during the Classical Period",4.730544030666351,gpt-4
Can you give me suggested question that I might use in an exam for that period?,"You haven't specified which period you're referring to. Could you please provide more details? For instance, are you asking about a specific historical period, a period in literature, or something else?",1.9829718876835536,gpt-4
Give me questions about the Classical period in cyprus,"1. What were the significant events during the Classical period in Cyprus?
2. Who were the prominent leaders in Cyprus during the Classical period?
3. How did the culture of Cyprus evolve during the Classical period?
4. What influence did the Classical period have on the art and architecture in Cyprus?
5. Can you explain the political structure of Cyprus during the Classical period?
6. What was the role of Cyprus in the Persian Wars during the Classical period?
7. How did the Classical period in Cyprus",1.9662296645300108,gpt-4
Have the greek Cypriots always constituted a majority in Cyprus?,"Yes, Greek Cypriots have historically been the majority in Cyprus. The population split was long largely between Greek Cypriots and Turkish Cypriots, with some smaller minorities as well. However, Greek Cypriots traditionally made up a larger portion of the population. According to a 1960 census, for example, Greek Cypriots made up around 77% of the island's population. This does not mean the power has always been evenly distributed or without conflict",4.177376186388055,gpt-4
what about the Classical Period of Cyprus?,"The Classical Period of Cyprus spans from 500 BC to 323 BC, coinciding with the death of Alexander the Great. This period is considered part of the larger Classical Age in Greek history. During this time, Cyprus was heavily influenced by Persian and Greek cultures due to the conquest of the island by both empires.

Persian rulers, from the Achaemenid dynasties, conquered Cyprus in 545 BC and dominance continued throughout much of the Classical Period. The island was divided into several",4.759671956300737,gpt-4
Tell me about the Annan plan and the April 2004 plebiscite.,"The Annan plan was a proposed plan to resolve the long-standing dispute between Turkish and Greek Cypriots on the island of Cyprus. It was presented by then-UN Secretary-General Kofi Annan in 2004. The plan sought to end the division of Cyprus by establishing a United Cyprus Republic, which would be a federation of two states, one Greek and one Turkish. 

The Annan plan addressed issues such as governance, security, territory, and property, intending to strike a balance",3.7614520788192767,gpt-4
What were the earliest known civilizations to inhabit Cyprus?,"The earliest known civilizations to inhabit Cyprus were the Chalcolithic and Early Bronze Age communities around 4500-2500 BC. However, the first significant civilization was the Eteocypriots, also known as the Alashiya civilization, around 2500-1050 BC. The Mycenaean Greeks gradually inhabited the island from approximately 1400 BC, which marked the beginning of the current Greek culture on Cyprus.",4.710857808589934,gpt-4
How did Cyprus fare during the Bronze Age?,"During the Bronze Age, around 2400-1050 BC, Cyprus fared quite well and had a significant role in the eastern Mediterranean. It had abundant copper resources, which were in high demand during the Bronze Age given that it’s a main component of bronze. This made Cyprus a hub of trade and metallurgy.

The island's strategic location made it an important trading center between the civilizations of the Near East, Egypt, and the Aegean. Several cities like Enkomi, H",2.6177059144002888,gpt-4
What role did Cyprus play in the trade networks of the ancient Mediterranean?,"Cyprus played a significant role in the trade networks of the ancient Mediterranean due to its advantageous geographical location and rich natural resources, mainly copper and timber. Its position between three continents: Europe, Africa, and Asia made it an essential station for traders and a crossroads of maritime routes, linking east and west, north and south.

In the Bronze Age, Cyprus established vast overseas trade relations. It was known for metalworking, particularly the production of copper, which became one of its most significant trade exports",1.7587492498964301,gpt-4
Who were the major powers that exerted influence over Cyprus in antiquity?,"In antiquity, Cyprus was under the influence of several major powers including:

1. The Mycenaean Greeks: Around 1400-1100 BC, during the Bronze Age, the Mycenaean Greeks were the first major power that exerted influence over Cyprus.

2. The Phoenicians: From about 800 BC, the Phoenicians started establishing trading posts on the island.

3. The Assyrians: The Assyrian Empire exerted influence over Cyprus around 700 BC",3.452326249789964,gpt-4
How did Cyprus come under Egyptian rule during the New Kingdom period?,"During the New Kingdom period (around 1550-1070 BC), the relationships between Egypt and Cyprus were mostly based on trade, diplomacy, and cultural exchange rather than direct rule. Cypriot kings recognized Egyptian pharaohs and sent them tribute, while Cyprus imported Egyptian goods and adopted some Egyptian artistic styles and religious beliefs.  

There are no concrete evidences to show that Cyprus was under direct Egyptian rule, however, some indirect influence is proven by the archaeological findings. 

The significant contact between",3.302100583910941,gpt-4
What evidence exists of Mycenaean influence on Cyprus?,"The Mycenaean influence on Cyprus can be seen through various archaeological finds, historical artifacts and cultural exchanges. Here are some significant evidences:

1. Pottery: Mycenaean pottery has been discovered throughout Cyprus, indicating that the island had a significant Mycenaean presence. The styles of pottery found include both typical and unusual Mycenaean motifs, suggesting that there might have been local production influenced by Mycenaean standards.

2. Architecture: Mycenaean architectural features",1.6069252783890149,gpt-4
How did Cyprus participate in the Greek Dark Ages?,"The Greek Dark Ages, also known as the Homeric Age or the Geometric Period, occurred between 1100 BC and 800 BC. This was a period of economic and cultural decline in Ancient Greece, after the collapse of the Mycenaean civilization and before the resurgence of ancient Greek culture.

During this period, Cyprus was not directly involved in Greece, as it was a separate and independent entity, culturally and politically. However, Cyprus detailed an interesting mixture of political control and cultural influences due",3.4725027423348327,gpt-4
